"status_id","tenant_id","status_name","status_code","description","color_code","is_final","display_order","is_active","created_at","updated_at"
"ffff0000-0000-0000-0000-000000000001","00000000-0000-0000-0000-000000000001","รอดำเนินการ","PENDING","เรื่องร้องเรียนที่รับเข้าระบบแล้ว รอการมอบหมายและดำเนินการ","#eab308",False,1,True,"2026-06-04 16:07:58.68344","2026-06-04 16:07:58.68344"
"ffff0000-0000-0000-0000-000000000002","00000000-0000-0000-0000-000000000001","กำลังดำเนินการ","IN_PROGRESS","เจ้าหน้าที่รับเรื่องและอยู่ระหว่างดำเนินการแก้ไข","#3b82f6",False,2,True,"2026-06-04 16:07:58.68344","2026-06-04 16:07:58.68344"
"ffff0000-0000-0000-0000-000000000003","00000000-0000-0000-0000-000000000001","พักงาน","PAUSED","การดำเนินการถูกพักไว้ชั่วคราว เช่น รอข้อมูลเพิ่มเติม หรือรอการอนุมัติ","#6b7280",False,3,True,"2026-06-04 16:07:58.68344","2026-06-04 16:07:58.68344"
"ffff0000-0000-0000-0000-000000000004","00000000-0000-0000-0000-000000000001","ถูกปฏิเสธ","REJECTED","เรื่องร้องเรียนถูกปฏิเสธ เนื่องจากไม่อยู่ในขอบเขตความรับผิดชอบหรือข้อมูลไม่เพียงพอ","#f87171",True,4,True,"2026-06-04 16:07:58.68344","2026-06-04 16:07:58.68344"
"ffff0000-0000-0000-0000-000000000005","00000000-0000-0000-0000-000000000001","แก้ไขแล้ว","RESOLVED","เจ้าหน้าที่ดำเนินการแก้ไขเสร็จสิ้นแล้ว รอการยืนยันจากผู้ร้องเรียน","#22c55e",False,5,True,"2026-06-04 16:07:58.68344","2026-06-04 16:07:58.68344"
"ffff0000-0000-0000-0000-000000000006","00000000-0000-0000-0000-000000000001","ปิด","CLOSED","เรื่องร้องเรียนปิดแล้ว ผู้ร้องเรียนยืนยันหรือเกินระยะเวลาการยืนยันอัตโนมัติ","#15803d",True,6,True,"2026-06-04 16:07:58.68344","2026-06-04 16:07:58.68344"
